categoryID,brandName,displayName,heroImage,productId,rating,reviews,longDescription,brandID,ingredientDesc,listPrice,quickLookDescription,lovesCount,fullSiteProductUrl
foundation-makeup,NARS,Natural Radiant Longwear Full Coverage Foundation,https://www.sephora.com/productimages/sku/s2814192-main-zoom.jpg?imwidth=270,P427301,3.6688,4028,"Makeup artist. Photographer. Iconoclast. Creative visionary François Nars launched NARS Cosmetics with 12 cult-favorite lipsticks in 1994, inspiring self-expression, creativity, and artistry with uncompromising pigment purity and imaginative color. Today, NARS’ boundary-pushing approach manifests from the pigments to the products to the photographed campaigns, shot by François himself—bringing high-fashion, high-style, and forward thinking to beauty. “Play and try to be a little bit daring. Break the rules.” –FRANÇOIS NARSFOUNDER & CREATIVE DIRECTOR OF NARS Cosmetics",nars,"Dimethicone, Water, Phenyl Trimethicone, Glycerin, Polymethylsilsesquioxane, Peg-10 Dimethicone, Dimethicone Crosspolymer, Cyclopentasiloxane, Trimethylsiloxysilicate, Ppg-3 Benzyl Ether Myristate, Boron Nitride, Bis-Butyldimethicone Polyglyceryl-3, Butylene Glycol, Sorbitan Sesquiisostearate, Rubus Idaeus (Raspberry) Fruit Extract, Citrullus Lanatus (Watermelon) Fruit Extract, Pyrus Malus (Apple) Fruit Extract, Lens Esculenta (Lentil) Fruit Extract, Tocopherol, Sodium Pca, Sodium Lactate, Disodium Stearoyl Glutamate, Hydrogenated Polydecene, Pentaerythrityl Tetraethylhexanoate, Peg/Ppg-14/7 Dimethyl Ether, Pentaerythrityl Tetra-Di-T-Butyl Hydroxyhydrocinnamate, Sodium Stearoyl Glutamate, Behenic Acid, Stearic Acid, Stearyl Alcohol, Behenyl Alcohol, Disteardimonium Hectorite, Triethoxycaprylylsilane, Barium Sulfate, Aluminum Dimyristate, Alumina, Tin Oxide, Polysilicone-2, Potassium Hydroxide, Phenoxyethanol, Sodium Benzoate, Potassium Sorbate, [+/- (May Contain): Mica, Titanium Dioxide (Ci 77891), Iron Oxides (Ci 77491), Iron Oxides (Ci 77492), Iron Oxides (Ci 77499)].",52.0,"<p>A buildable, full-coverage foundation with up to 16 hours of lightweight, natural, fade-resistant wear.</p>",453940.0,
foundation-makeup,ONE/SIZE by Patrick Starrr,Turn Up the Base Full Beat Waterproof Liquid Foundation,https://www.sephora.com/productimages/sku/s2801199-main-zoom.jpg?imwidth=270,P513724,4.3793,551,,,,,,0.0,
foundation-makeup,Sephora Favorites,Complexion Try-On Sample Bag With Redeemable Voucher,https://www.sephora.com/productimages/sku/s2823409-main-zoom.jpg?imwidth=270,P514455,3.5833,12,,,,,,0.0,
foundation-makeup,HAUS LABS BY LADY GAGA,Triclone Skin Tech Medium Coverage Foundation with Fermented Arnica,https://www.sephora.com/productimages/sku/s2597276-main-zoom.jpg?imwidth=270&pb=allure-2023-clean-badge,P502185,4.0823,3646,"HAUS LABS BY LADY GAGA: Welcome to the Future of Clean Makeup. Our supercharged, clean artistry makeup is powered by innovation, created for everyone at all application levels, shapes, sizes, colors, ages, and genders. Our makeup is high-tech, high-pigment, and high-performance—presented in an all-new, chic, color-coded, sustainable packaging system. Our inclusive, futuristic formulas are made with patented complexes and proprietary ingredients that deliver skincare benefits. All Haus Labs products are created with kindness—clean, cruelty-free, and vegan. 
 
At Haus, CLEAN goes beyond the 2,600+ ingredients we ban, and rather what’s included. We are committed to cutting-edge, clean ingredient innovations, including our exclusive patent-pending Fermented Arnica, which is 860% times more powerful than conventional arnica. Our name reflects our beliefs: “Haus” represents a creative collective, and “Labs” represents our commitment to biotech. THE FUTURE IS BEAUTIFUL.",haus-labs-by-lady-gaga,"- Fermented Arnica: Helps visibly reduces redness and irritation.<br>- Intellizen 7 Complex&trade;: Proprietary blend of medicinal herbs that promote healing and calming.<br>- BioFerment 7 Complex&trade;: Proprietary blend of super antioxidants that protect the skin from stress.<br><br>Aqua (Water, Eau), Diphenylsiloxy Phenyl Trimethicone, Phenyl Trimethicone, Caprylyl Methicone, Trimethylsiloxysilicate, Propylene Glycol Dibenzoate, Isododecane, Glycerin, Butylene Glycol, Methyl Trimethicone, Lauryl Polyglyceryl-3 Polydimethylsiloxyethyl Dimethicone, C13-15 Alkane, Polyglyceryl-3 Polydimethylsiloxyethyl Dimethicone, Alcohol Denat., Acrylates/Polytrimethylsiloxymethacrylate Copolymer, Polymethylsilsesquioxane, Sorbitan Sesquioleate, Disteardimonium Hectorite, 1,2-Hexanediol, Palmitoyl Tetrapeptide-10, Arnica Montana Flower Extract**, Hydrolyzed Hyaluronic Acid, Squalane, Pseudozyma Epicola/Camellia Sinensis Seed Oil Ferment Extract Filtrate, Pseudozyma Epicola/Apricot Kernel Oil/Olive Fruit Oil/Sweet Almond Oil/Sunflower Seed Oil/Licorice Root Extract Ferment Extract Filtrate, Pseudozyma Epicola/Apricot Kernel Oil/Olive Fruit Oil/Sunflower Seed Oil/Sweet Almond Oil/(Angelica Gigas/Lithospermum Erythrorhizon) Root, Solanum Lycopersicum (Tomato) Fruit Extract, Dunaliella Salina Extract, Hedychium Coronarium Root Extract, Tocopherol, Althaea Rosea Flower Extract, Taraxacum Officinale (Dandelion) Extract, Perilla Ocymoides Leaf Extract, Panax Notoginseng Extract, Glycyrrhiza Glabra (Licorice) Root Extract, Chamomilla Recutita (Matricaria) Extract, Centella Asiatica Extract, Pseudozyma Epicola/Sunflower Seed Oil Ferment Extract Filtrate, Caprylyl Glycol, Ethylhexylglycerin, Magnesium Sulfate, Polypropylsilsesquioxane, Acrylates/Dimethicone Copolymer, Triethoxycaprylylsilane, Dimethicone/Vinyl Dimethicone Crosspolymer, Aluminum Hydroxide, CI 77891 (Titanium Dioxide), CI 77491/77492/77499 (Iron Oxides).<br>**Fermented.<br><br>.<br><br><i>The list of ingredients is subject to change, please consult the packaging of the product purchased.</i>",49.0,"An advanced, skincare-infused, long-wearing foundation that delivers buildable, medium coverage with a naturally luminous finish in 51 ultra-fluid shades.",750299.0,
foundation-makeup,Armani Beauty,Luminous Silk Perfect Glow Flawless Oil-Free Foundation,https://www.sephora.com/productimages/sku/s1359694-main-zoom.jpg?imwidth=270,P393401,4.2128,4733,"Giorgio Armani translates his sense of fashion and his aesthetic vision into the world of fragrances, make-up and skincare. Elegance is key: beauty, simplicity and quality are delivered through products made from the finest materials, designed to convey an understated and timeless sophistication.",giorgio-armani-beauty," -Micro-Fil Technology: Provides a translucent radiance and flawless finish.<br><br>Aqua / Water, Cyclopentasiloxane, Glycerin, Isododecane, Alcohol Denat., Polyglyceryl-4 Isostearate, Cetyl Peg/Ppg-10/1 Dimethicone, Hexyl Laurate, Aluminum Starch Octenylsuccinate, Disteardimonium Hectorite, Phenoxyethanol, Acetylated Glycol Stearate, Magnesium Sulfate, Peg-10 Dimethicone, Trihydroxystearin, Cellulose Gum, Nylon-12, Limonene, Benzyl Salicylate, Benzyl Alcohol, Linalool, Pentaerythrityl Tetra-Di-T-Butyl Hydroxyhydrocinnamate, Isobutane, Diphenyl Dimethicone, Acrylonitrile/Methyl Methacrylate/Vinylidene Chloridecopolymer, Parfum / Fragrance, Disodium Stearoyl Glutamate, Methylparaben, Butylphenyl Methylpropional, Aluminum Hydroxide, Hexyl Cinnamal.",69.0,"<p>An award-winning, oil-free foundation that delivers buildable, medium coverage and a luminous, glowy-skin finish for a natural makeup look.</p>",904378.0,
foundation-makeup,Charlotte Tilbury,Hollywood Flawless Filter,https://www.sephora.com/productimages/sku/s2419786-main-zoom.jpg?imwidth=270,P434104,4.2406,3425,"Founded by British makeup artist Charlotte Tilbury, MBE, in 2013, Charlotte Tilbury Beauty revolutionized the face of the global beauty industry by decoding makeup application for everyone, at every age, with an easy-to-use, easy-to-choose, easy-to-gift range. The company mission is to share the power of makeup, using Charlotte’s award-winning, iconic makeup and research-powered skincare products, to show everyone how easy it is to look and feel like the most beautiful versions of themselves every single day.",charlotte-tilbury,"-Finely Milled Powders: Blur lines and pores for a smoother, soft-focus look.<br>-Porcelain Flower Extract: A Thai flower derivative that brightens and moisturizes skin.<br>-Glossy Oil: A lightweight moisturizing oil that reflects and adds light where you need it.<br><br> Aqua/Water/Eau, Hydrogenated Didecene, Mica, Glycerin, Propanediol, Squalane, Cetyl Peg/Ppg-10/1 Dimethicone, Isoamyl Laurate, Hydrogenated Styrene/Isoprene Copolymer, Sodium Chloride, Caprylic/Capric Triglyceride, Hydroxyacetophenone, Polyglyceryl-4 Isostearate, 1,2-Hexanediol, Caprylyl Glycol, Trisodium Ethylenediamine Disuccinate, Hoya Lacunosa Flower Extract, Pentaerythrityl Tetra-Di-T-Butyl Hydroxyhydrocinnamate, [+/- Titanium Dioxide (Ci 77891), Iron Oxides (Ci 77491, Ci 77492, Ci 77499), Bismuth Oxychloride (Ci 77163)].",49.0,"<p>A complexion booster that blurs, smooths, and illuminates for a real-life filter effect. Customize your glow with four ways to apply.</p>",793058.0,
foundation-makeup,HUDA BEAUTY,Easy Blur Natural Airbrush Foundation with Niacinamide,https://www.sephora.com/productimages/sku/s2787125-main-zoom.jpg?imwidth=270,P512640,4.568,2734,,,,,,0.0,
foundation-makeup,SEPHORA COLLECTION,Best Skin Ever Liquid Foundation,https://www.sephora.com/productimages/sku/s2326890-main-zoom.jpg?imwidth=270&pb=2023-03-sephora-value-2023,P467140,4.1735,1643,,,,,,0.0,
foundation-makeup,NARS,Light Reflecting Advanced Skincare Medium Coverage Foundation,https://www.sephora.com/productimages/sku/s2514586-main-zoom.jpg?imwidth=270&pb=allure-2022-bestofbeauty-badge,P479338,4.112,2606,,,,,,0.0,
foundation-makeup,Estée Lauder,Double Wear Stay-in-Place 24-Hour Longwear Foundation,https://www.sephora.com/productimages/sku/s2602043-main-zoom.jpg?imwidth=270,P378284,4.3656,7546,"Estée Lauder offers an unparalleled collection of skincare, makeup, and fragrance products, including bestsellers and proven solutions. As one of the world's most beloved and respected brands, the Estée Lauder name is recognized in over 100 countries as a symbol of quality, luxury, and promises kept.",estee-lauder,"<p>Double Wear Stay-In-Place Non Otc Division: El (Estee Lauder)Ingredients: Water, Cyclopentasiloxane, Trimethylsiloxysilicate, Peg/Ppg-18/18 Dimethicone, Butylene Glycol, Tribehenin, Polyglyceryl-3 Diisostearate, Magnesium Sulfate, Tocopheryl Acetate, Polymethylsilsesquioxane, Methicone, Laureth-7, Xanthan Gum, Alumina, Sodium Dehydroacetate, Disteardimonium Hectorite, Cellulose Gum, Propylene Carbonate, Pentaerythrityl Tetra-Di-T-Butyl Hydroxyhydrocinnamate, Phenoxyethanol, [+/- Iron Oxides (Ci 77491, Ci 77492, Ci 77499), Mica, Titanium Dioxide (Ci 77891)] </p><p>Please be aware that ingredient lists may change or vary from time to time.� Please refer to the ingredient list on the product package you receive for the most up to date list of ingredients.</p>",52.0,"A 24-hour liquid foundation with a flawless, natural, matte finish that unifies uneven skin tone and covers imperfections with buildable coverage.",834689.0,
foundation-makeup,LYS Beauty,Triple Fix Blurring and Hydrating Skin Tint Foundation Stick,https://www.sephora.com/productimages/sku/s2823011-main-zoom.jpg?imwidth=270&pb=clean-at-sephora,P513483,4.6019,216,,,,,,0.0,
foundation-makeup,DIOR,Backstage Face & Body Foundation,https://www.sephora.com/productimages/sku/s2669539-main-zoom.jpg?imwidth=270,P432500,4.362,5201,"From catwalk-inspired cosmetics to cutting-edge skin care and timeless fragrances, Christian Dior has brought us some of the most luxurious, trendsetting, and fashionable beauty products around. It's this magical mix of couture-meets-cosmetics that not only attracts celebrities, supermodels, and the society set, but also has solidified Dior's reputation as one of the most unabashedly stylish beauty brands in the world.",dior,"-Squalane<br>-Hyaluronic Acid<br><br>Aqua (Water), C9-12 Alkane, Propanediol, Caprylic/Capric Triglyceride, Undecane, Polyglyceryl-6 Polyricinoleate, Glycerin, Tridecane, Cellulose, Trimethylsiloxysilicate, Lecithin, Alcohol, Pentylene Glycol, Polyglyceryl-10 Decaisostearate, Silica, Polyglyceryl-2 Isostearate, Stearalkonium Hectorite, Disteardimonium Hectorite, Parfum (Fragrance), Hydroxypropyl Starch, Sodium Chloride, Sodium Myristoyl Glutamate, Propylene Carbonate, Coco-Caprylate/Caprate, Hydroxyacetophenone, Sodium Benzoate, Squalane, Aluminum Hydroxide, Tocopherol, Stearoyl Glutamic Acid, Polyhydroxystearic Acid, Hyaluronic Acid, Citric Acid, Isostearic Acid, Polyglyceryl-3 Polyricinoleate, [+/- Ci 77891 (Titanium Dioxide), Ci 77491, Ci 77492, Ci 77499 (Iron Oxides)].",43.0,"A hydrating foundation that delivers buildable coverage for the face and body, resists heat and humidity, and leaves a luminous makeup look.",553986.0,
foundation-makeup,Fenty Beauty by Rihanna,Pro Filt’r Soft Matte Longwear Liquid Foundation,https://www.sephora.com/productimages/sku/s1925478-main-zoom.jpg?imwidth=270,P87985432,4.0204,17418,,,,,,0.0,
foundation-makeup,Hourglass,Veil™ Hydrating Skin Tint Foundation,https://www.sephora.com/productimages/sku/s2690915-main-zoom.jpg?imwidth=270&pb=allure-2023-bestofbeauty-badge,P506573,4.4802,1316,,,,,,0.0,
foundation-makeup,DIOR,Forever Skin Perfect 24H Multi-Use Foundation Stick,https://www.sephora.com/productimages/sku/s2789220-main-zoom.jpg?imwidth=270,P512480,4.5008,1196,"From catwalk-inspired cosmetics to cutting-edge skin care and timeless fragrances, Christian Dior has brought us some of the most luxurious, trendsetting, and fashionable beauty products around. It's this magical mix of couture-meets-cosmetics that not only attracts celebrities, supermodels, and the society set, but also has solidified Dior's reputation as one of the most unabashedly stylish beauty brands in the world.",dior,"C15-19 Alkane, Caprylic/Capric Triglyceride, Helianthus Annuus (Sunflower) Seed Wax, Saccharomyces Ferment, Coco-Caprylate/Caprate, Silica, Phytosteryl/Octyldodecyl Lauroyl Glutamate, Mica, Polyglyceryl-2 Triisostearate, Iris Florentina Root Extract, Aluminum Hydroxide, Parfum (Fragrance), Brassica Campestris (Rapeseed) Seed Oil, Candelilla Cera (Euphorbia Cerifera (Candelilla) Wax), Cera Carnauba (Copernicia Cerifera (Carnauba) Wax), Lauroyl Lysine, Disteardimonium Hectorite, Opuntia Ficus-Indica Flower Extract, Camelina Sativa Seed Oil, Pentaerythrityl Tetra-Di-T-Butyl Hydroxyhydrocinnamate, Aqua (Water), Tocopherol, Sodium Benzoate, Potassium Sorbate, [+/- CI 77891 (Titanium Dioxide), CI 77491, CI 77492, CI 77499 (Iron Oxides)].",52.0,"A multi-use foundation stick for a natural, blurred finish with up 24 hours of wear and all-day hydration.<br>",89648.0,
foundation-makeup,MERIT,The Minimalist Perfecting Complexion Foundation and Concealer Stick,https://www.sephora.com/productimages/sku/s2791861-main-zoom.jpg?imwidth=270&pb=clean-at-sephora,P468694,3.9665,2505,,,,,,0.0,
foundation-makeup,Bobbi Brown,Weightless Skin Oil-Controlling Foundation SPF 15 with Hyaluronic Acid,https://www.sephora.com/productimages/sku/s2798403-main-zoom.jpg?imwidth=270,P512885,4.8065,1726,,,,,,0.0,
foundation-makeup,Charlotte Tilbury,Airbrush Flawless Finish Setting Powder,https://www.sephora.com/productimages/sku/s2605988-main-zoom.jpg?imwidth=270,P433526,4.1303,2839,,,,,,0.0,
foundation-makeup,Fenty Beauty by Rihanna,Soft’Lit Naturally Luminous Hydrating Longwear Foundation,https://www.sephora.com/productimages/sku/s2746543-main-zoom.jpg?imwidth=270&pb=allure-2024-bestofbeauty,P511130,4.5073,1654,"Rihanna created Fenty Beauty “so that women everywhere would be included,” focusing on a wide range of traditionally hard-to-match skin tones, developing formulas that work for all skin types, and pinpointing universal shades. Her vision, above all, is to inspire: “Makeup is there for you to have fun with. It should never feel like pressure. It should never feel like a uniform. Feel free to take chances, and take risks, and dare to do something new or different.”",fenty-beauty-rihanna,"Aqua/Water/Eau, Dimethicone, Butylene Glycol Dicaprylate/Dicaprate, Diphenylsiloxy Phenyl Trimethicone, Glycerin, Synthetic Fluorphlogopite, Cetyl Peg/Ppg-10/1 Dimethicone, Trisiloxane, Butylene Glycol, 1,2-Hexanediol, Trimethylsiloxysilicate, Disteardimonium Hectorite, Peg-10 Dimethicone, Polyphenylsilsesquioxane, Magnesium Sulfate, Dimethicone Crosspolymer, Caprylyl Methicone, Lauroyl Lysine, Triethoxycaprylylsilane, Aluminum Hydroxide, Polyhydroxystearic Acid, Ethylhexyl Palmitate, Isopropyl Myristate, Isostearic Acid, Lecithin, Terminalia Ferdinandiana Fruit Extract, Trisodium Ethylenediamine Disuccinate, Polyglyceryl-3 Polyricinoleate, Cyperus Rotundus Root Extract, Titanium Dioxide (Ci 77891), Iron Oxides (Ci 77491, Ci 77492, Ci 77499).<br>",40.0,<p>A hydrating and brightening waterproof foundation that reduces shine for a notch above natural finish.</p>,63010.0,
foundation-makeup,SEPHORA COLLECTION,Best Skin Ever Matte Powder Foundation,https://www.sephora.com/productimages/sku/s2667400-main-zoom.jpg?imwidth=270&pb=2023-03-sephora-value-2023,P505903,3.9028,535,"As Sephora’s own brand, we flex our extensive industry knowledge to create paycheck-friendly products that perform on par with more spendy ones. So whether you’re looking for a ride-or-die eyeliner or a clean skincare routine that doesn’t require a small investment, rest assured: Sephora Collection will wow you and your wallet.",sephora-collection,"-Aquatic Microcells from Vegetal Origin: Improve skin texture.<br><br>Synthetic Fluorphlogopite, Dimethicone, Nylon-12, Polypropylene, CI 77891 (Titanium Dioxide), CI 77492 (Iron Oxides), CI 77491 (Iron Oxides), Zinc Stearate, Methylpropanediol, CI 77499 (Iron Oxides), Diisostearyl Malate, Sodium Dehydroacetate, Caprylyl Glycol, Caprylic/Capric Triglyceride, Illite, Helianthus Annuus (Sunflower) Seed Oil, Dimethicone Crosspolymer, Phenylpropanol, Chlorella Vulgaris Extract, Rosmarinus Officinalis (Rosemary) Leaf Extract. <br>",22.0,A matte powder version of SEPHORA COLLECTION&rsquo;s Best Skin Ever foundation.<br>,46080.0,
foundation-makeup,MAKE UP FOR EVER,HD Skin Waterproof Natural Matte Foundation,https://www.sephora.com/productimages/sku/s2514214-main-zoom.jpg?imwidth=270,P479712,4.0769,2862,,,,,,0.0,
foundation-makeup,ILIA,Super Serum Skin Tint SPF 40 Skincare Foundation,https://www.sephora.com/productimages/sku/s2333607-main-zoom.jpg?imwidth=270,P455418,3.6852,6426,,,,,,0.0,
foundation-makeup,MAKEUP BY MARIO,SurrealSkin™ Luminous Hydrating Foundation,https://www.sephora.com/productimages/sku/s2620235-main-zoom.jpg?imwidth=270&pb=allure-2023-bestofbeauty-badge,P503679,4.0393,2823,,,,,,0.0,
foundation-makeup,IT Cosmetics,CC+ Cream Full Coverage Color Correcting Foundation with SPF 50+,https://www.sephora.com/productimages/sku/s2599835-main-zoom.jpg?imwidth=270,P411885,4.0137,7816,,,,,,0.0,
foundation-makeup,Tower 28 Beauty,Swipe All-Over Hydrating Serum Concealer,https://www.sephora.com/productimages/sku/s2697670-main-zoom.jpg?imwidth=270&pb=clean-at-sephora,P507142,4.339,2012,,,,,,0.0,
foundation-makeup,Rare Beauty by Selena Gomez,Liquid Touch Weightless Foundation,https://www.sephora.com/productimages/sku/s2361392-main-zoom.jpg?imwidth=270,P49848448,3.962,5770,"Created by Selena Gomez, Rare Beauty is challenging unrealistic standards of perfection. In Selena’s own words, “It’s not about being someone else, but being who you are.” This is makeup made to feel good in, without hiding what makes you unique. Airy and breathable, our skin-loving formulas go on easy for adjustable coverage and a fresh finish that always looks like you.",rare-beauty-by-selena-gomez,"Isohexadecane, Isododecane, C12-15 Alkyl Benzoate, Hydrogenated Polyisobutene, Isononyl Isononanoate, Synthetic Fluorphlogopite, PEG-10 Dimethicone, Trimethylsiloxysilicate, Disteardimonium Hectorite, Dimethicone, Silica, Propylene Carbonate, Triethoxycaprylylsilane, Helianthus Annuus (Sunflower) Seed Oil, Tocopherol, Gardenia Florida Fruit Extract, Nelumbo Nucifera (Sacred Lotus) Flower Extract, Nymphaea Odorata Root Extract, Phenoxyethanol,  Achillea Millefolium Flower/Leaf/Stem Extract, Ascophyllum Nodosum Extract, Panax Ginseng Root Extract, Passiflora Edulis (Passion Fruit) Fruit Extract, Tilia Cordata (Linden) Flower Extract, Tussilago Farfara (Coltsfoot) Leaf Extract, [+/- May Contain/Peut Contenir: Titanium Dioxide (CI 77891), Iron Oxides (CI 77491, CI 77492, CI 77499)].",30.0,An innovative breathable foundation that combines the weightless feel of a serum with buildable medium coverage for truly layerable wear. ,370486.0,
foundation-makeup,PATRICK TA,Major Skin Hydra-Luxe Luminous Skin Perfecting Foundation For Natural Glow,https://www.sephora.com/productimages/sku/s2793578-main-zoom.jpg?imwidth=270,P513075,4.1887,742,"""I see makeup as my way of connecting with people. I want to share the feeling of having your make up done by an artist because everyone deserves to feel confident and glamorous every day.""- PATRICK TA",patrick-ta,"-Three Forms of Hyaluronic Acid: Visibly plump and hydrate. <br>-Plant-Derived Squalane: Visibly improves elasticity and diffuses fine lines. <br>-Kombucha: Enhances the look of smoothness and radiance. <br><br>Water (Aqua, Eau), Glycerin, Isononyl Isononanoate, Propanediol, Dicaprylyl Ether, Squalane, Pentaerythrityl Tetraisostearate, Hydrogenated Styrene/Methylstyrene/Indene Copolymer, Hydrogenated Ethylhexyl Olivate, Polyglyceryl-6 Polyricinoleate, Polyglyceryl-2 Dipolyhydroxystearate, Isostearyl Neopentanoate, C9-12 Alkane, Dimer Dilinoleyl Dimer Dilinoleate, Polyglyceryl-2 Isostearate, PVP, Lauroyl Lysine, Dipalmitoyl Hydroxyproline, Myristyl Myristate, Magnesium Sulfate, Disteardimonium Hectorite, Lecithin, Phenoxyethanol, Propylene Carbonate, Zinc Stearate, Octyldodecyl Stearoyl Stearate, Hydrogenated Lecithin, Butyrospermum Parkii (Shea) Butter, Sodium Benzoate, Saccharomyces/Xylinum/Black Tea Ferment, Distarch Phosphate, Allantoin, Hydrogenated Olive Oil Unsaponifiables, Coco-Caprylate/Caprate, Tocopherol, Sodium Hyaluronate, Sodium Dehydroacetate, Helianthus Annuus (Sunflower) Seed Oil, Pentaerythrityl Tetra-di-t-butyl Hydroxyhydrocinnamate, Potassium Sorbate, May Contain (+/-): Titanium Dioxide (CI 77891), Iron Oxides (CI 77491, CI 77492, CI 77499).",58.0,"A lightweight and luminous foundation with serum-inspired ingredients and a buildable, medium-coverage formula that boosts hydration and blurs the look of imperfections.",72127.0,
foundation-makeup,ROSE INC,Softlight Skin-Smoothing Hydrating Non-Comedogenic Foundation,https://www.sephora.com/productimages/sku/s2698108-main-zoom.jpg?imwidth=270&pb=clean-planet-aware,P507996,4.6774,558,"Effortless and effective. Clean and clinically proven. Sensual and sustainable. We unite efficacy and ethics in formulas charged by proprietary bioengineered botanicals and safe synthetic ingredients. 

“We’ve identified the values most important to us and found a way for them to coexist in one brand.” Rosie Huntington-Whiteley",rose-inc,"-Adaptive Skin-Balancing Complex: Visibly reduces redness, pores, excess oil; good for acne-prone skin.<br>-Targeted Hydration Complex with Ectoin: Emollient blend to calm, replenish, and hydrate skin where needed.<br>-Fermented Reishi Mushroom: Supports the moisture barrier for plumper-, smoother-looking skin.<br><br>Water/Aqua/Eau, Dimethicone, Trisiloxane, Glycerin, C9-12 Alkane, Polyphenylsilsesquioxane, Phenyl Trimethicone, Polyglyceryl-3 Polydimethylsiloxyethyl Dimethicone, Propanediol, Octyldodecanol, Dimethicone/Polyglycerin-3 Crosspolymer, Dimethicone/Vinyl Dimethicone Crosspolymer, Ectoin, Squalane, Ganoderma Lucidum (Mushroom) Extract, Evodia Rutaecarpa Fruit Extract, Leptospermum Scoparium Branch/Leaf Oil, Magnolia Officinalis Bark Extract, Piper Nigrum (Pepper) Seed Extract, Disteardimonium Hectorite, Pentylene Glycol, Caprylyl Glycol, Triethoxycaprylylsilane, Tocopherol, Triethyl Citrate, Sodium Citrate, Sodium Chloride, Ethylhexylglycerin, Xanthan Gum, 1,2-Hexanediol, [+/-: Iron Oxides (CI 77491, CI 77492, CI 77499), Titanium Dioxide (CI 77891)].<br><br>.<br><br><i>The list of ingredients is subject to change, please consult the packaging of the product purchased.</i>",54.0,"A clean, medium coverage foundation that&rsquo;s weightless, buildable, and non-comedogenic with a natural finish.",33412.0,
