categoryID,brandName,displayName,heroImage,productId,rating,reviews,longDescription,brandID,ingredientDesc,listPrice,quickLookDescription,lovesCount,fullSiteProductUrl
foundation-makeup,Bobbi Brown,Vitamin Enriched Hydrating Skin Tint SPF 15 with Hyaluronic Acid,https://www.sephora.com/productimages/sku/s2701662-main-zoom.jpg?imwidth=270,P506571,4.5793,1046,"Founded in 1991 by legendary makeup artist Bobbi Brown, this global premium beauty brand celebrates the individual beauty of all women around the world. From face products that are expressly designed to look like skin to colors that enhance eyes, cheeks, and lips, Bobbi Brown encapsulates the essence of modern beauty.",bobbi-brown,"-Provitamin D and Cactus Flower: Support a strong skin barrier.<br>-Vitamin E Complex: Defends skin from environmental aggressors. <br>-Hyaluronic Acid and Shea Butter: Immediately moisturize, soften, and condition.<br><br>Water/Aqua/Eau, Ethylhexyl Methoxycinnamate, Glyceryl Triacetyl Ricinoleate, Octyldodecyl Neopentanoate, Diethylhexyl Succinate, Butylene Glycol, Ethylhexyl Salicylate, Titanium Dioxide, Butyrospermum Parkii (Shea) Butter, Glycerin, Steareth-21, Glyceryl Stearate, Citrus Grandis (Grapefruit) Peel Oil, Pelargonium Graveolens (Geranium) Flower Oil, Cereus Grandiflorus (Cactus) Flower Extract, Lactobacillus Ferment, Niacinamide, Ethylhexylglycerin, Caprylyl Glycol, Cholesterol, Isohexadecane, 7-Dehydrocholesterol, Sodium Hyaluronate, Biosaccharide Gum-1, Magnesium Aluminum Silicate, Aluminum Hydroxide, Steareth-2, Cetyl Alcohol, Acrylamide/Sodium Acryloyldimethyltaurate Copolymer, Xanthan Gum, Lecithin, Potassium Stearate, Sodium Hydroxide, Polysorbate 80, Sorbitan Oleate, Citric Acid, Limonene, Citronellol, Geraniol, Linalool, Citral, Tocopheryl Acetate, BHT, Phytic Acid, Disodium EDTA, Magnesium Ascorbyl Phosphate, Phenoxyethanol, Sorbic Acid,  [+/- Mica, Titanium Dioxide (CI 77891), Iron Oxides (CI 77491), Iron Oxides (CI 77492), Iron Oxides (CI 77499)].",48.0,"<p>A 2-in-1 buildable skin tint delivering 12hr hydration while providing long-wearing, natural-looking coverage that’s sweat proof &amp; humidity resistant.</p>",27536.0,
foundation-makeup,Beautyblender,12-Hour Always on Radiant Skin Tint with Hyaluronic Acid & Niacinamide,https://www.sephora.com/productimages/sku/s2477453-main-zoom.jpg?imwidth=270,P477136,4.4424,1268,,,,,,0.0,
foundation-makeup,Fenty Beauty by Rihanna,Eaze Drop Stick Blur + Smooth Tint Stick Foundation,https://www.sephora.com/productimages/sku/s2700805-main-zoom.jpg?imwidth=270,P507453,4.0111,632,,,,,,0.0,
foundation-makeup,tarte,Amazonian clay blurring powder foundation,https://www.sephora.com/productimages/sku/s2641306-main-zoom.jpg?imwidth=270,P504215,3.58,50,"Over a decade ago, beauty aficionado Maureen Kelly channeled her entrepreneurial spirit and set out to prove that glamour can be good for you. Launched in the heart of New York City, tarte is a smart, colorful brand offering healthy, eco-chic beauty products that truly work. Tarte’s cruelty-free, high-performance beauty is infused with pure, invigorating ingredients, and all tarte products are formulated without parabens, mineral oil, phthalates, sodium lauryl sulfate, triclosan, and synthetic fragrances. From award-winning blushes and lip tints to the breakthrough Amazonian clay and maracuja complexion products, tarte delivers powerful results for real woman.  Be green, be smart, be tarte.",tarte,"Ingredients: Mica, zinc stearate, silica, coco-caprylate/caprate, octyldodecyl stearoyl stearate, sodium starch octenylsuccinate, magnesium myristate, synthetic fluorphlogopite, lauroyl lysine, kaolin, glyceryl caprylate, pentylene glycol, cetyl alcohol, tocopheryl acetate, magnolia officinalis bark extract, squalane, boron nitride, ricinus communis (castor) seed oil, hydrolyzed sodium hyaluronate, sodium hyaluronate, hydrogenated castor oil, tin oxide, alumina, magnesium oxide. (+/-): Titanium Dioxide (CI 77891), yellow 5 lake (CI 19140), iron oxides (CI 77491, CI 77492, CI 77499).",40.0,"<p>A bestselling foundation, now in a powder.</p>",15510.0,
foundation-makeup,tarte,Mini Amazonian Clay 16-Hour Full Coverage Foundation,https://www.sephora.com/productimages/sku/s2476190-main-zoom.jpg?imwidth=270,P473843,3.5455,55,"Over a decade ago, beauty aficionado Maureen Kelly channeled her entrepreneurial spirit and set out to prove that glamour can be good for you. Launched in the heart of New York City, tarte is a smart, colorful brand offering healthy, eco-chic beauty products that truly work. Tarte’s cruelty-free, high-performance beauty is infused with pure, invigorating ingredients, and all tarte products are formulated without parabens, mineral oil, phthalates, sodium lauryl sulfate, triclosan, and synthetic fragrances. From award-winning blushes and lip tints to the breakthrough Amazonian clay and maracuja complexion products, tarte delivers powerful results for real woman.  Be green, be smart, be tarte.",tarte,"-Amazonian Clay: Acts as nature's most perfect ingredient for better, longer, truer wear.<br><br>Cyclopentasiloxane, Water/Aqua/Eau, Isododecane, Butylene Glycol, Dimethicone, Polymethyl Methacrylate, Polysilicone-11, PEG-9 Polydimethylsiloxyethyl Dimethicone, Trimethylsiloxysilicate, Dimethicone/PEG-10/15 Crosspolymer, Phenoxyethanol, Magnesium Sulfate, HDI/Trimethylol Hexyllactone Crosspolymer, Aluminum Hydroxide, Sodium Citrate, Fragrance/Parfum, Tocopheryl Acetate, C24-28 Alkyl Methicone, Triethoxycaprylylsilane, Ethylhexylglycerin, Kaolin, Dipropylene Glycol, Silica, Benzyl Salicylate, Hexyl Cinnamal, Limonene, Hydroxycitronellal, Geraniol, Tocopherol, Amyl Cinnamal, Linalool. (+/-): Titanium Dioxide (CI 77891), Iron Oxides (CI 77491, CI 77492, CI 77499).",18.0,"A mini oil free, 16-hour full-coverage foundation. Formulated with Amazonian clay for a light-weight feel and matte finish.<br>",13489.0,
foundation-makeup,CLINIQUE,Moisture Surge CC Cream Hydrating Colour Corrector Broad Spectrum SPF 30,https://www.sephora.com/productimages/sku/s1509512-main-zoom.jpg?imwidth=270,P378639,3.7601,813,,,,,,0.0,
foundation-makeup,tarte,BB blur tinted moisturizer Broad Spectrum SPF 30 Sunscreen,https://www.sephora.com/productimages/sku/s2413045-main-zoom.jpg?imwidth=270,P377542,4.2515,3594,,,,,,0.0,
foundation-makeup,Kosas,Mini Cloud Set Baked Setting & Smoothing Talc-Free Vegan Powder,https://www.sephora.com/productimages/sku/s2673598-main-zoom.jpg?imwidth=270&pb=clean-at-sephora,P505832,3.4679,498,,,,,,0.0,
foundation-makeup,Fenty Skin,Hydra Vizor Huez Tinted Moisturizer Broad Spectrum Mineral Spf 30 Sunscreen,https://www.sephora.com/productimages/sku/s2766111-main-zoom.jpg?imwidth=270&pb=clean-at-sephora,P511541,4.3479,1259,,,,,,0.0,
foundation-makeup,Givenchy,Prisme Libre Skin-Caring Matte Foundation,https://www.sephora.com/productimages/sku/s2509677-main-zoom.jpg?imwidth=270,P481706,4.4394,924,,,,,,0.0,
foundation-makeup,ONE/SIZE by Patrick Starrr,Turn Up The Base Versatile Powder Foundation,https://www.sephora.com/productimages/sku/s2426930-main-zoom.jpg?imwidth=270&pb=allure-best-2021-badge,P469953,4.1166,746,,,,,,0.0,
foundation-makeup,Valentino,Very Valentino 24 Hour Long Wear Liquid Foundation,https://www.sephora.com/productimages/sku/s2542710-main-zoom.jpg?imwidth=270,P479509,4.3389,478,,,,,,0.0,
foundation-makeup,DIOR,Forever Natural Velvet Matte Compact Foundation,https://www.sephora.com/productimages/sku/s2595072-main-zoom.jpg?imwidth=270,P297404,4.1875,48,"From catwalk-inspired cosmetics to cutting-edge skin care and timeless fragrances, Christian Dior has brought us some of the most luxurious, trendsetting, and fashionable beauty products around. It's this magical mix of couture-meets-cosmetics that not only attracts celebrities, supermodels, and the society set, but also has solidified Dior's reputation as one of the most unabashedly stylish beauty brands in the world.",dior,"-Iris Extract: Delivers antioxidant benefits. <br>-Wild Pansy Flower Extract: Preserves hydration. <br>-Rose Extract: Visibly refines pores.<br><br>Synthetic Fluorphlogopite, Mica, Calcium Sodium Borosilicate, Silica, Butylene Glycol Dicaprylate/Dicaprate, Boron Nitride, Zinc Stearate, Caprylic/Capric/Succinic Triglyceride, Polyglyceryl-2 Triisostearate, Pentylene Glycol, Aqua (Water), Caprylyl Glycol, Iris Florentina Root Extract, Ethylhexylglycerin, Butylene Glycol, Sodium Dehydroacetate, Parfum (Fragrance), Aluminum Hydroxide, Isopropyl Titanium Triisostearate, Rosa Centifolia Flower Wax, Rosa Damascena Flower Wax, Sodium Lauroyl Aspartate, Hydrolyzed Viola Tricolor Extract, Rosa Multiflora Fruit Extract, Tocopherol, Zinc Chloride, Tropaeolum Majus Flower/Leaf/Stem Extract, 1,2-Hexanediol, Sodium Benzoate, Potassium Sorbate, [+/- CI 77891 (Titanium Dioxide), CI 77491, CI 77492, CI 77499 (Iron Oxides)].",60.0,"A transfer-proof compact foundation that visibly reduces shine and provides up to 24 hours of natural-looking, matte coverage with a smooth, refined finish. <br>",53002.0,
foundation-makeup,tarte,Amazonian Clay 16-Hour Full Coverage Foundation,https://www.sephora.com/productimages/sku/s2476083-main-zoom.jpg?imwidth=270,P473821,3.3092,676,,,,,,0.0,
foundation-makeup,Westman Atelier,Vital Skincare Complexion Drops Dewy Skin Tint,https://www.sephora.com/productimages/sku/s2597888-main-zoom.jpg?imwidth=270&pb=clean-at-sephora,P501795,3.7018,627,,,,,,0.0,
foundation-makeup,MAKE UP FOR EVER,Matte Velvet Skin Full Coverage Foundation,https://www.sephora.com/productimages/sku/s2106565-main-zoom.jpg?imwidth=270,P434023,3.8196,2051,"MAKE UP FOR EVER views makeup as a means of self-expression. For nearly four decades, we’ve been dedicated to delivering pro-grade products to all, while sharing our passion for cosmetics through education and artistry. We believe mastery unleashes creativity and we encourage everyone—from the beginner to the professional—to discover and celebrate their true selves through the art of makeup.",make-up-for-ever,"Water, Cyclopentasiloxane, Corn Starch Modified, Bis-Peg/Ppg-14/14 Dimethicone, Neopentyl Glycol Diethylhexanoate, Glycerin, Disteardimonium Hectorite, Dimethicone, Methylpropanediol, Silica Dimethyl Silylate, Cellulose, Synthetic Fluorphlogopite, Magnesium Sulfate, Sodium Chloride, Xanthan Gum, Glyceryl Caprylate, Sodium Myristoyl Glutamate, Phenoxyethanol, Propylene Carbonate, Fragrance, Dimethicone Crosspolymer, Chlorphenesin, Pentylene Glycol, Aluminum Hydroxide, Solum Diatomeae (Diatomaceous Earth), Isododecane, Butylene Glycol, Trimethylsiloxysilicate/Dimethiconol Crosspolymer, Benzyl Salicylate, Tocopherol, Benzyl Benzoate, Limonene, Sanguisorba Officinalis Root Extract, Cinnamomum Cassia Bark Extract, Zingiber Officinale (Ginger) Root Extract. May Contain (+/-): Yellow 5/Yellow 5 Lake (Ci 19140), Blue 1 Lake (Ci 42090), Ultramarines (Ci 77007), Bismuth Oxychloride (Ci 77163), Iron Oxides (Ci 77491, Ci 77492, Ci 77499), Titanium Dioxide (Ci 77891).<br><br> Product ingredient listings are updated periodically. Before using a MAKE UP FOR EVER product, please read the ingredient list on the packaging to ensure that the ingredients are suitable for your personal use",40.0,"A full-coverage, waterproof foundation that provides a velvety-matte finish and up to 24 hours of wear.",105075.0,
foundation-makeup,Danessa Myricks Beauty,Yummy Skin Serum Foundation,https://www.sephora.com/productimages/sku/s2574861-main-zoom.jpg?imwidth=270,P481694,3.7669,326,,,,,,0.0,
foundation-makeup,Shiseido,Synchro Skin Radiant Lifting Foundation SPF 30,https://www.sephora.com/productimages/sku/s2416501-main-zoom.jpg?imwidth=270,P468401,4.4597,1549,"Beauty innovation. Born in Japan.Established in 1872, Shiseido is one of the world’s most-trusted beauty brands. Built on a foundation of respect for Japanese ingredients and culture, Shiseido is renowned for its commitment to tradition and quest for innovation. In skincare, sun care, and makeup, Shiseido offers superior products and unparalleled technologies that celebrate the art and science of beautiful skin.",shiseido,"-Light-Adjusting Technology: Visibly lifts, refines, and smooths for a luminous-looking finish. <br>-Radiant Microcrystals: Correct the look of shadows created by fine lines and wrinkles so that skin appears smoother and firmer.<br>-Transparent, Luminous Pearl: Visually counteracts hyperpigmentation by creating an even canvas to optimally reflect light.<br><br>Octinoxate 6.9%, Titanium Dioxide 1.0%, Water, Dimethicone, Diphenylsiloxy Phenyl Trimethicone Glycerin, Trifluoropropyldimethyl/Trimethylsiloxysilicate,Butylene Glycol, Hydrogenated Polydecene,PEG-10 Dimethicone, Bis-Butyldimethicone Polyglyceryl-3,Disteardimonium Hectorite, Erythritol, Xylitol, Sorbitan Sesquiisostearate, Polyquaternium-51, Citrus Unshiu Peel Extract, Thymus Serpyllum Extract, Fagus Sylvatica Bud Extract, Hydrolyzed Conchiolin Protein, Dimethicone/Vinyl Dimethicone Crosspolymer, Dimethicone/PEG-10/15 Crosspolymer, Barium Sulfate, Synthetic Fluorphlogopite, Aluminum Hydroxide, Polysilicone-2, Disodium EDTA, Stearic Acid, Calcium Aluminum Borosilicate, Tocopherol, Dipropylene Glycol, Triethoxycaprylylsilane, Triethoxysilylethyl Polydimethylsiloxyethyl Dimethicone, BHT, Alumina, Polymethylsilsesquioxane, Phenoxyethanol, Titanium Dioxide, Iron Oxides, Mica.",47.0,"A luminous foundation that hydrates for up to 24 hours and adapts to your skin for a medium-to-full coverage, with radiant finish.",47433.0,
foundation-makeup,Laura Mercier,Tinted Moisturizer Natural Skin Perfector Broad Spectrum SPF 30,https://www.sephora.com/productimages/sku/s2250595-main-zoom.jpg?imwidth=270,P109936,4.0368,3315,,,,,,0.0,
foundation-makeup,Lancôme,Care and Glow Serum Concealer with Hyaluronic Acid,https://www.sephora.com/productimages/sku/s2716157-main-zoom.jpg?imwidth=270,P508271,4.5475,610,,,,,,0.0,
foundation-makeup,CLINIQUE,Even Better Clinical™ Serum Foundation Broad Spectrum SPF 25,https://www.sephora.com/productimages/sku/s2422566-main-zoom.jpg?imwidth=270,P468639,3.5638,188,,,,,,0.0,
foundation-makeup,MAKE UP FOR EVER,Ultra HD Invisible Cover Stick Foundation,https://www.sephora.com/productimages/sku/s1713221-main-zoom.jpg?imwidth=270,P398775,4.0386,2798,"MAKE UP FOR EVER views makeup as a means of self-expression. For nearly four decades, we’ve been dedicated to delivering pro-grade products to all, while sharing our passion for cosmetics through education and artistry. We believe mastery unleashes creativity and we encourage everyone—from the beginner to the professional—to discover and celebrate their true selves through the art of makeup.",make-up-for-ever,"Ethylhexyl Palmitate, Synthetic Fluorphlogopite, Dipentaerythrityl Hexahydroxystearate/Hexastearate/Hexarosinate, Synthetic Wax, Polyglyceryl-2 Triisostearate, Hydrogenated Polyisobutene, Sorbitan Sesquiisostearate, Methicone, Dimethicone, Copernicia Cerifera (Carnauba) Wax, Vinyl Dimethicone/Methicone Silsesquioxane Crosspolymer, Alumina, Tocopherol, Propanediol, Fragrance, Water, Sucrose Palmitate, Benzyl Benzoate, Evodia Rutaecarpa Fruit Extract, Tocopheryl Acetate, Glyceryl Linoleate, Benzyl Alcohol, Citric Acid, Potassium Sorbate, Sodium Hyaluronate, Tin Oxide, Bht. May Contain (+/-): Yellow 5/Yellow 5 Lake (Ci 19140), Blue 1 Lake (Ci 42090), Ultramarines (Ci 77007), Bismuth Oxychloride (Ci 77163), Iron Oxides (Ci 77491, Ci 77492, Ci 77499), Titanium Dioxide (Ci 77891).<br><br> Product ingredient listings are updated periodically. Before using a MAKE UP FOR EVER product, please read the ingredient list on the packaging to ensure that the ingredients are suitable for your personal use",43.0,"A creamy, blendable foundation stick with long-lasting, buildable coverage that glides on like a second skin.",173464.0,
foundation-makeup,Fenty Beauty by Rihanna,Mini Pro Filt’r Soft Matte Longwear Liquid Foundation,https://www.sephora.com/productimages/sku/s2656049-main-zoom.jpg?imwidth=270,P476525,3.6018,113,,,,,,0.0,
foundation-makeup,MILK MAKEUP,Flex Foundation Stick,https://www.sephora.com/productimages/sku/s2242261-main-zoom.jpg?imwidth=270&pb=clean-at-sephora,P448151,4.0913,1183,"At Milk Makeup, they believe it’s not just about how you create your look; it’s what you do in it that matters. Their unique multi-use products are designed for an on-the-go lifestyle, with high-tech ingredients—without all the bad stuff. Milk Makeup is inspired by its home, Milk Studios, a cultural hub of creators in NY and LA. At Milk Makeup, there are no rules. Live Your Look.",milk-makeup,"-Marshmallow Root Extract: Allows the formula to move with your face and never crease or cake.<br>-Blue Lotus: Moisturizes.<br>-Chamomile and Lavender: Help calm and soothe skin.<br><br> Ethylhexyl Palmitate, Bis-Diglyceryl Polyacyladipate-2,
Octyldodecanol, Polyethylene, Silica, Microcrystalline Wax/Cera Microcristallina/Cire
Microcristalline, Pentaerythrityl Hydrogenated Rosinate, Mica, Polyglyceryl-3 Diisostearate,
Mica, Copernicia Cerifera (Carnauba) Wax/Cire de Carnauba, Euphorbia Cerifera (Candelilla)
Wax/Cire de Candelilla, Lavandula Angustifolia (Lavender) Oil, Helianthus Annuus (Sunflower)
Seed Oil, Trifolium Pratense (Clover) Flower Extract, Althaea Officinalis Root Extract,
Chamomilla Recutita (Matricaria) Flower Extract, Nymphaea Caerulea Flower Extract,
Tocopheryl Acetate, Tocopherol, Ascorbyl Palmitate, Hydrogenated Polyisobutene,
Disteardimonium Hectorite, Octyldodecyl Neopentanoate, Isononyl Isononanoate,
Pentaerythrityl Tetra-di-t-butyl Hydroxyhydrocinnamate, Butylene Glycol, Aqua/Water/Eau,
HDI/Trimethylol Hexyllactone Crosspolymer, Isopentyldiol, Propylene Carbonate,
Phenoxyethanol, Linalool, Titanium Dioxide (CI 77891), Iron Oxides (CI 77491, CI 77492, CI
77499)<br><br>Many of Milk Makeup’s products now have the Sephora Clean Seal. However, a few of their current products are still being reformulated to meet Sephora’s Clean standards. While this happens, the ingredient lists may change in real time. Please check the ingredient list on your product packaging for the most up-to-date formulation. FYI: This doesn’t mean product performance will be affected. These formulas will be the ones you know and love, now just Sephora Clean as well.<br><br><i>The list of ingredients is subject to change, please consult the packaging of the product purchased.</i>",36.0,"A medium coverage, natural finish foundation that covers, calms, and flexes without creasing or caking.",91763.0,
foundation-makeup,caliray,Freedreaming Blurring Lightweight Skin Tint,https://www.sephora.com/productimages/sku/s2546729-main-zoom.jpg?imwidth=270&pb=clean-planet-aware,P480579,4.195,641,,,,,,0.0,
foundation-makeup,bareMinerals,Original Loose Matte Talc-Free Powder Mineral Foundation SPF 15,https://www.sephora.com/productimages/sku/s1922749-main-zoom.jpg?imwidth=270&pb=clean-at-sephora,P240604,4.3818,7871,"THE BEAUTY OF MINERALS | We started the clean beauty revolution when we launched our best-selling mineral foundation in 1995, and since then we’ve continued to create clean, cruelty-free makeup and skincare products that never compromise on performance. Our good-for-skin formulas are free of harsh chemicals and unnecessary additives, and full of botanical extracts and natural minerals.",bareminerals,"-Titanium Dioxide and Zinc Oxide: Provide mineral sun protection.
<br>
<br> Lauroyl Lysine, Titanium Dioxide, Zinc Oxide, Silica, Calcium Silicate, Mica, Iron Oxides.<br><br><i>The list of ingredients is subject to change, please consult the packaging of the product purchased.</i>",39.0,"A clean, loose mineral foundation that delivers buildable sheer-to-full coverage with a matte finish while helping to control excess oil.",90920.0,
foundation-makeup,Laura Mercier,Tinted Moisturizer Light Revealer Natural Skin Illuminator Broad Spectrum SPF 25,https://www.sephora.com/productimages/sku/s2551406-main-zoom.jpg?imwidth=270,P479972,4.193,746,,,,,,0.0,
foundation-makeup,Iris&Romeo,"Best Skin Days Treatment Concealer with Vitamin C, Hyaluronic Acid and Niacinamide",https://www.sephora.com/productimages/sku/s2758225-main-zoom.jpg?imwidth=270&pb=clean-at-sephora,P510037,4.4831,89,"Michele Gough-Baril founded Iris&Romeo after two decades in the beauty industry, climbing her way to the top. Burned out by the persistent excess and hustle culture, she stepped away to the healing rhythms of Northern California and gave herself permission to live fully, deeply, and with purpose.

And Iris&Romeo was born. We are the antidote to the beauty hustle culture and the more-is-more mentality.

We make multifunctional, all-in-one, tinted skincare solutions of the highest quality and efficacy. They simplify your morning routine and deliver skin wellness—instantly and over time. This kind of beauty—this undone, well-hydrated look combined with serum strength actives—is the effortless bare-faced beauty we all want. 

Less makeup. More you.
",iris-romeo,"-Kakadu Plum (Vitamin C): High-potency vitamin C visibly firms, supports collagen, and brightens the look of dark circles.<br>-Licorice Root: Serum-strength active to keep dark spots from developing.<br>-Hyaluronic Acid: Thoroughly penetrates to hydrate and visibly plump the skin.<br><br>Water/Aqua/Eau, Undecane, Hydrogenated Ethylhexyl Olivate , Polyglyceryl-6 Polyricinoleate, Tridecane, Caprylic/Capric Triglyceride, Butylene Glycol, Trimethylsiloxysilicate, Disteardimonium Hectorite, Polyglyceryl-4 Isostearate, Sodium Chloride, Oryza Sativa (Rice) Bran Oil, Mica, Jojoba Esters, Aluminum Hydroxide, Synthetic Fluorphlogopite, Caprylyl Glycol, 1,2-Hexanediol, Sodium Dehydroacetate, Helianthus Annuus (Sunflower) Seed Wax, Hydrogenated Olive Oil Unsaponifiables, Xanthan Gum, Sodium Lauroyl Glutamate, Terminalia Ferdinandiana Fruit Extract, Glycerin, Sodium Phytate, Sodium Hyaluronate, Niacinamide, Silica, Lysine, Menthone Glycerin Acetal, Magnesium Chloride, Polyglycerin-3, Acacia Decurrens Flower Wax, Triethoxycaprylylsilane, Glycyrrhiza Glabra (Licorice) Root Extract, Allantoin, Tin Oxide, Tocopherol, Alcohol, Lycopene, Xanthophylls, Sodium Benzoate, Citric Acid, May Contain (+/-): Iron Oxides (Ci 77491, Ci 77492, Ci 77499), Titanium Dioxide (Ci 77891).<br><br><i>The list of ingredients is subject to change, please consult the packaging of the product purchased.</i>",32.0,"A supercharged eye serum and dark spot treatment inside a medium-coverage, hydrating concealer with a brightening, invisible second-skin finish.",10854.0,
foundation-makeup,Shiseido,RevitalEssence Skin Glow Foundation SPF 30,https://www.sephora.com/productimages/sku/s2711463-main-zoom.jpg?imwidth=270,P507997,4.3849,517,,,,,,0.0,
foundation-makeup,Benefit Cosmetics,Boi-ing Cakeless Full Coverage Waterproof Liquid Concealer,https://www.sephora.com/productimages/sku/s2519684-main-zoom.jpg?imwidth=270,P448162,4.3089,6733,"Laughter is the best cosmetic! Benefit Cosmetics is like your super-funny, free-spirited, badass beauty BFF who’s obsessed with brows. From our products to our packaging, we’re all about making beauty fun.",benefit-cosmetics,"Aqua (Water), Cyclopentasiloxane, Butylene Glycol, Cyclohexasiloxane, Methyl Methacrylate Crosspolymer, Peg-10 Dimethicone, Trimethylsiloxysilicate, Cetyl Peg/Ppg-10/1 Dimethicone, Sodium Chloride, Disteardimonium Hectorite, Triethoxycaprylylsilane, Phenoxyethanol, Caprylyl Glycol, Dimethicone/Vinyl Dimethicone Crosspolymer, Propylene Carbonate, Biosaccharide Gum-4, Alumina, Magnesium Oxide, Alpha-Glucan Oligosaccharide, Propanediol, Algin, Pentaerythrityl Tetra-Di-T-Butyl Hydroxyhydrocinnamate. [+/-: Ci 19140 (Yellow 5, Yellow 5 Lake), Ci 42090 (Blue 1 Lake), Ci 77007 (Ultramarines), Ci 77163 (Bismuth Oxychloride), Ci 77491, Ci 77492, Ci 77499 (Iron Oxides), Ci 77891 (Titanium Dioxide)].<br><br>DISCLAIMER: PRODUCT INGREDIENT LISTINGS ARE UPDATED PERIODICALLY. BEFORE USING A BENEFIT PRODUCT, PLEASE READ THE INGREDIENT LIST ON THE PACKAGING OF YOUR PRODUCT TO BE SURE THAT THE INGREDIENTS ARE APPROPRIATE FOR YOUR PERSONAL USE.",27.0,"This multipurpose, full-coverage liquid concealer hides it all, from dark under-eye circles to blemishes, and discoloration. ",68247.0,
